{
  "project_id": "0191b2a0-0000-7000-8000-000000000001",
  "chapter_id": "0191b2a0-0000-7000-8000-000000020009",
  "manuscript_version_id": "0191b2a0-0000-7000-8000-000000030009",
  "base_canon_version": 8,
  "stage": "verified",
  "items": [
    {
      "local_id": "ev-1",
      "type": "event",
      "op": "assert",
      "frame": "canonical",
      "story_clock": {
        "chapter_no": 9,
        "ordinal": 40,
        "world_date": "D+35",
        "precision": "exact"
      },
      "payload": {
        "type": "injury",
        "summary": "On the second floor of the Poison Fog Dungeon, Mu-jin shoves Do-yoon clear and takes a fog-beast tendril in the left calf; the venom spreads.",
        "location_id": "0191b2a0-0000-7000-8000-000000010002",
        "participants": [
          {
            "entity_id": "0191b2a0-0000-7000-8000-0000000c0003",
            "role": "patient"
          },
          {
            "entity_id": "0191b2a0-0000-7000-8000-0000000c0001",
            "role": "witness"
          }
        ],
        "importance": "core"
      },
      "evidence": [
        {
          "manuscript_version_id": "0191b2a0-0000-7000-8000-000000030009",
          "chapter_no": 9,
          "paragraph_id": "p41",
          "start": 4120,
          "end": 4164,
          "quote": "Black venom was climbing Mu-jin’s left calf."
        }
      ],
      "confidence": 0.97,
      "importance": "core",
      "reconciliation_status": "agreed",
      "verification": {
        "evidence_ok": true,
        "entities_ok": true,
        "frame_ok": true,
        "validity_ok": true,
        "contradiction": "none",
        "leak_check_ok": true
      }
    },
    {
      "local_id": "f-1",
      "type": "fact",
      "op": "assert",
      "frame": "canonical",
      "story_clock": {
        "chapter_no": 9,
        "ordinal": 40,
        "world_date": "D+35",
        "precision": "exact"
      },
      "payload": {
        "entity_id": "0191b2a0-0000-7000-8000-0000000c0003",
        "attribute": "status.injury",
        "key": "left_leg_venom",
        "value": {
          "part": "left calf",
          "kind": "beast venom",
          "severity": "serious",
          "expected_recovery": "unknown"
        },
        "value_text": "Beast venom in the left calf (serious)",
        "valid_from": {
          "chapter_no": 9,
          "ordinal": 40,
          "world_date": "D+35",
          "precision": "exact"
        },
        "valid_to": null
      },
      "evidence": [
        {
          "manuscript_version_id": "0191b2a0-0000-7000-8000-000000030009",
          "chapter_no": 9,
          "paragraph_id": "p41",
          "start": 4120,
          "end": 4164,
          "quote": "Black venom was climbing Mu-jin’s left calf."
        }
      ],
      "confidence": 0.97,
      "importance": "core",
      "reconciliation_status": "agreed",
      "verification": {
        "evidence_ok": true,
        "entities_ok": true,
        "frame_ok": true,
        "validity_ok": true,
        "contradiction": "none",
        "leak_check_ok": true
      }
    },
    {
      "local_id": "f-2",
      "type": "fact",
      "op": "supersede",
      "frame": "canonical",
      "story_clock": {
        "chapter_no": 9,
        "ordinal": 5,
        "world_date": "D+35",
        "precision": "exact"
      },
      "supersedes_ref": "0191b2a0-0000-7000-8000-000000040004",
      "payload": {
        "entity_id": "0191b2a0-0000-7000-8000-0000000c0003",
        "attribute": "status.location",
        "value": "0191b2a0-0000-7000-8000-000000010002",
        "value_text": "Poison Fog Dungeon, second floor",
        "valid_from": {
          "chapter_no": 9,
          "ordinal": 5,
          "world_date": "D+35",
          "precision": "exact"
        },
        "valid_to": null
      },
      "evidence": [
        {
          "manuscript_version_id": "0191b2a0-0000-7000-8000-000000030009",
          "chapter_no": 9,
          "paragraph_id": "p6",
          "start": 512,
          "end": 569,
          "quote": "Past the second-floor stairs the fog rose to their knees."
        }
      ],
      "confidence": 0.9,
      "importance": "minor",
      "reconciliation_status": "single_source",
      "verification": {
        "evidence_ok": true,
        "entities_ok": true,
        "frame_ok": true,
        "validity_ok": true,
        "contradiction": "supersedes",
        "leak_check_ok": true
      }
    },
    {
      "local_id": "k-1",
      "type": "knowledge_state",
      "op": "assert",
      "frame": "canonical",
      "story_clock": {
        "chapter_no": 9,
        "ordinal": 44,
        "world_date": "D+35",
        "precision": "exact"
      },
      "payload": {
        "knower": {
          "kind": "character",
          "entity_id": "0191b2a0-0000-7000-8000-0000000c0003"
        },
        "proposition_id": "0191b2a0-0000-7000-8000-0000000b0007",
        "stance": "unaware",
        "source": {
          "kind": "narration",
          "chapter_id": "0191b2a0-0000-7000-8000-000000020009"
        },
        "valid_from": {
          "chapter_no": 9,
          "ordinal": 44,
          "precision": "exact"
        },
        "valid_to": null
      },
      "evidence": [
        {
          "manuscript_version_id": "0191b2a0-0000-7000-8000-000000030009",
          "chapter_no": 9,
          "paragraph_id": "p45",
          "start": 4510,
          "end": 4599,
          "quote": "Mu-jin glanced at the old compass that had slipped from Do-yoon’s pocket, then forgot it."
        }
      ],
      "confidence": 0.82,
      "importance": "minor",
      "reconciliation_status": "agreed",
      "verification": {
        "evidence_ok": true,
        "entities_ok": true,
        "frame_ok": true,
        "validity_ok": true,
        "contradiction": "none",
        "leak_check_ok": true
      }
    },
    {
      "local_id": "r-1",
      "type": "relationship_state",
      "op": "supersede",
      "frame": "canonical",
      "story_clock": {
        "chapter_no": 9,
        "ordinal": 60,
        "world_date": "D+35",
        "precision": "exact"
      },
      "payload": {
        "from_entity_id": "0191b2a0-0000-7000-8000-0000000c0003",
        "to_entity_id": "0191b2a0-0000-7000-8000-0000000c0001",
        "type": "mentor",
        "axes": {
          "trust": 3,
          "affection": 2,
          "respect": 2,
          "hostility": 0,
          "dependency": 1
        },
        "power_dynamic": "from_dominant",
        "register": {
          "formality": 1,
          "deference": 0,
          "familiarity": 3,
          "intimacy": 1,
          "directness": 4,
          "contractions": "free",
          "address_terms": [
            "kid",
            "Do-yoon",
            "son"
          ],
          "titles": []
        },
        "valid_from": {
          "chapter_no": 9,
          "ordinal": 60,
          "precision": "exact"
        },
        "valid_to": null
      },
      "evidence": [
        {
          "manuscript_version_id": "0191b2a0-0000-7000-8000-000000030009",
          "chapter_no": 9,
          "paragraph_id": "p58",
          "start": 5620,
          "end": 5686,
          "quote": "“If it weren’t for you, son, I’d have died first. I pay my debts.”"
        }
      ],
      "confidence": 0.88,
      "importance": "major",
      "reconciliation_status": "adjudicated",
      "adjudication_call_id": "0191b2a0-0000-7000-8000-000000090001",
      "verification": {
        "evidence_ok": true,
        "entities_ok": true,
        "frame_ok": true,
        "validity_ok": true,
        "contradiction": "supersedes",
        "leak_check_ok": true,
        "notes": "A read trust 4, B read trust 3 → adjudicator chose 3 based on the quote"
      }
    },
    {
      "local_id": "pr-1",
      "type": "promise_event",
      "op": "advance",
      "frame": "canonical",
      "story_clock": {
        "chapter_no": 9,
        "ordinal": 45,
        "precision": "exact"
      },
      "payload": {
        "promise_id": "0191b2a0-0000-7000-8000-0000000d0001",
        "kind": "advanced",
        "note": "The compass needle trembled in the fog (hidden-gate setup advanced)"
      },
      "evidence": [
        {
          "manuscript_version_id": "0191b2a0-0000-7000-8000-000000030009",
          "chapter_no": 9,
          "paragraph_id": "p46",
          "start": 4570,
          "end": 4609,
          "quote": "The compass needle trembled in the fog."
        }
      ],
      "confidence": 0.8,
      "importance": "major",
      "reconciliation_status": "agreed",
      "verification": {
        "evidence_ok": true,
        "entities_ok": true,
        "frame_ok": true,
        "validity_ok": true,
        "contradiction": "none",
        "leak_check_ok": true
      }
    }
  ],
  "unresolved_questions": [
    "Which venom (determines the recovery window)—to be established by Seo-ha's diagnosis in ch.13 (planned)"
  ],
  "hypothesis_results": [
    {
      "hypothesis_ref": "contract:ch09:MH-1",
      "result": "realized",
      "note": "Mu-jin injured"
    },
    {
      "hypothesis_ref": "contract:ch09:MH-2",
      "result": "realized",
      "note": "Second floor reached"
    },
    {
      "hypothesis_ref": "contract:ch09:MH-3",
      "result": "unrealized",
      "note": "Planned three mana stones; the text shows two → recorded as partially unrealized; next contract adjusts"
    }
  ],
  "summary_l1": "Poison Fog Dungeon, second floor. When a fog beast ambushes them, Mu-jin shoves Do-yoon clear and takes venom in his left calf. Do-yoon, using prior-life memory, targets the beast's glowing organ and drives it off, but Mu-jin takes it for luck. On the way out the compass needle trembles. Mu-jin tells Do-yoon he pays his debts. Two mana stones recovered.",
  "ending_hook": "Outside the gate, the black venom had climbed to Mu-jin's knee.",
  "reconciliation": {
    "agreed": 4,
    "single_source": 1,
    "conflicts": 1,